PMID,PMCID,DOI,Title,Authors,Year,Journal,Volume,Issue,Pages,Abstract
10190907,PMC2193004,10.1084/jem.189.7.1157,Cytotoxic T lymphocyte-associated antigen 4 (CTLA-4) can regulate dendritic cell-induced activation and cytotoxicity of CD8(+) T cells independently of CD4(+) T cell help.,"McCoy KD, Hermans IF, Fraser JH, Le Gros G, Ronchese F",1999,J Exp Med,189,7,1157-62,"The mechanisms that regulate the strength and duration of CD8(+) cytotoxic T cell activity determine the effectiveness of an antitumor immune response. To better understand the antitumor effects of anti-cytotoxic T lymphocyte-associated antigen 4 (CTLA-4) antibody treatment, we analyzed the effect of CTLA-4 signaling on CD8(+) T cells in vitro and in vivo. In vitro, cross-linking of CTLA-4 on purified CD8(+) T cells caused decreased proliferative responses to anti-CD3 stimulation and rapid loss of activation marker expression. In vivo, blockade of CTLA-4 by neutralizing anti-CTLA-4 mAb greatly enhanced the accumulation, activation, and cytotoxic activity of CD8(+) T cells induced by immunization with Ag on dendritic cells (DC). This enhanced response did not require the expression of MHC class II molecules on DC or the presence of CD4(+) T cells. These results demonstrate that CTLA-4 blockade is able to directly enhance the proliferation and activation of specific CD8(+) T cells, indicating its potential for tumor immunotherapy even in situations in which CD4(+) T cell help is limited or absent."
9817207,PMC7095117,10.1038/23974,Structure of the haemagglutinin-esterase-fusion glycoprotein of influenza C virus.,"Rosenthal PB, Zhang X, Formanowski F, Fitz W, Wong CH, Meier-Ewert H, Skehel JJ, Wiley DC",1998,Nature,396,6706,92-6,"The spike glycoproteins of the lipid-enveloped orthomyxoviruses and paramyxoviruses have three functions: to recognize the receptor on the cell surface, to mediate viral fusion with the cell membrane, and to destroy the receptor. In influenza C virus, a single glycoprotein, the haemagglutinin-esterase-fusion (HEF) protein, possesses all three functions. In influenza A and B, the first two activities are mediated by haemagglutinin and the third by a second glycoprotein, neuraminidase. Here we report the crystal structure of the HEF envelope glycoprotein of influenza C virus. We have identified the receptor-binding site and the receptor-destroying enzyme (9-O-acetylesterase) sites, by using receptor analogues. The receptor-binding domain is structurally similar to the sialic acid-binding domain of influenza A haemagglutinin, but binds 9-O-acetylsialic acid. The esterase domain has a structure similar to the esterase from Streptomyces scabies and a brain acetylhydrolase. The receptor domain is inserted into a surface loop of the esterase domain and the esterase domain is inserted into a surface loop of the stem. The stem domain is similar to that of influenza A haemagglutinin, except that the triple-stranded, alpha-helical bundle diverges at both of its ends, and the amino terminus of HEF2, the fusion peptide, is partially exposed. The segregation of HEF's three functions into structurally distinct domains suggests that the entire stem region, including sequences at the amino and carboxy termini of HEF1 which precede the post-translational cleavage site between HEF1 and HEF2, forms an independent fusion domain which is probably derived from an ancestral membrane fusion protein."
10831607,PMC2174828,10.1083/jcb.149.5.1027,Yeast nucleoporins involved in passive nuclear envelope permeability.,"Shulga N, Mosammaparast N, Wozniak R, Goldfarb DS",2000,J Cell Biol,149,5,1027-38,"The vertebrate nuclear pore complex (NPC) harbors an approximately 10-nm diameter diffusion channel that is large enough to admit 50-kD polypeptides. We have analyzed the permeability properties of the Saccharomyces cerevisiae nuclear envelope (NE) using import (NLS) and export (NES) signal-containing green fluorescent protein (GFP) reporters. Compared with wild-type, passive export rates of a classical karyopherin/importin (Kap) Kap60p/Kap95p-targeted NLS-GFP reporter (cNLS-GFP) were significantly faster in nup188-Delta and nup170-Delta cells. Similar results were obtained using two other NLS-GFP reporters, containing either the Kap104p-targeted Nab2p NLS (rgNLS) or the Kap121p-targeted Pho4p NLS (pNLS). Elevated levels of Hsp70 stimulated cNLS-GFP import, but had no effect on the import of rgNLS-GFP. Thus, the role of Hsp70 in NLS-directed import may be NLS- or targeting pathway-specific. Equilibrium sieving limits for the diffusion channel were assessed in vivo using NES-GFP reporters of 36-126 kD and were found to be greater than wild-type in nup188-Delta and nup170-Delta cells. We propose that Nup170p and Nup188p are involved in establishing the functional resting diameter of the NPC's central transport channel."
3491082,PMC2114629,10.1083/jcb.103.6.2421,Integrin (the CSAT antigen): functionality requires oligomeric integrity.,"Buck CA, Shea E, Duggan K, Horwitz AF",1986,J Cell Biol,103,6 Pt 1,2421-8,"Integrin, the cell-substrate attachment (CSAT) antigen, is a complex of integral membrane glycoproteins whose apparent function is to mediate cell-substratum adhesion by serving as a transmembrane link between the extracellular matrix and elements of the cytoskeleton. Previous attempts to separate the members of this complex under nondenaturing conditions have been successful. We have now produced a monoclonal antibody ""G"" that is specific for the lower molecular mass cysteine-rich band 3 of the complex. Using an antibody affinity column containing this monoclonal antibody, it is possible to dissociate integrin into two fractions, one containing band 3, the other containing bands 1 plus 2. Neither fraction will by itself bind fibronectin, laminin, or talin. However, when the fractions are combined, the reconstituted integrin elutes from a gel filtration column in the same position as the native complex, and binding activity to these molecules returns. Further, it is shown by gel filtration that the recognition site for the adhesion-disrupting monoclonal antibodies CSAT and JG22 is on band 3, supporting the contention that integrin is an oligomer. The data presented here is consistent with integrin being either a mixture of heterodimers, each with a common subunit and reacting with a particular extracellular matrix molecule, or a single heterotrimer capable of binding to several different extracellular matrix molecules."
11266456,PMC2199621,10.1083/jcb.152.2.411,Gradient of increasing affinity of importin beta for nucleoporins along the pathway of nuclear import.,"Ben-Efraim I, Gerace L",2001,J Cell Biol,152,2,411-7,"Nuclear import and export signals on macromolecules mediate directional, receptor-driven transport through the nuclear pore complex (NPC) by a process that is suggested to involve the sequential binding of transport complexes to different nucleoporins. The directionality of transport appears to be partly determined by the nucleocytoplasmic compartmentalization of components of the Ran GTPase system. We have analyzed whether the asymmetric localization of discrete nucleoporins can also contribute to transport directionality. To this end, we have used quantitative solid phase binding analysis to determine the affinity of an importin beta cargo complex for Nup358, the Nup62 complex, and Nup153, which are in the cytoplasmic, central, and nucleoplasmic regions of the NPC, respectively. These nucleoporins are proposed to provide progressively more distal binding sites for importin beta during import. Our results indicate that the importin beta transport complex binds to nucleoporins with progressively increasing affinity as the complex moves from Nup358 to the Nup62 complex and to Nup153. Antibody inhibition studies support the possibility that importin beta moves from Nup358 to Nup153 via the Nup62 complex during import. These results indicate that nucleoporins themselves, as well as the nucleocytoplasmic compartmentalization of the Ran system, are likely to play an important role in conferring directionality to nuclear protein import."
40314372,PMC12051613,10.1080/20008066.2025.2494480,Causal relationship between inflammatory cytokines and posttraumatic stress disorder: a Mendelian randomization study and potential mechanism analysis.,"Li Y, Xu B, Chen Z",2025,Eur J Psychotraumatol,16,1,2494480,"Background: Post-traumatic stress disorder (PTSD) is a complex condition linked to inflammation. The causality between inflammatory cytokines and PTSD risk remains unclear.Methods: We conducted a bidirectional two-sample Mendelian randomization (MR) study using genome-wide association study (GWAS) data from 41 inflammatory cytokines and PTSD. Additional analyses included differential gene expression, protein-protein interaction, and functional enrichment to explore underlying mechanisms.Results: MR analysis indicated that higher levels of stem cell factor (SCF) and interleukin-4 (IL-4) are associated with a reduced risk of PTSD. Genes POGZ and LRIG2 were identified as mediators, implicated in the TGF-beta signalling pathway.Conclusion: Our findings suggest a protective role of certain cytokines against PTSD and highlight potential molecular mediators. This knowledge could inform future therapeutic strategies for PTSD."
35330785,PMC8938598,10.1177/24715492211038172,Development of a Machine Learning Algorithm for Prediction of Complications and Unplanned Readmission Following Reverse Total Shoulder Arthroplasty.,"Devana SK, Shah AA, Lee C, Gudapati V, Jensen AR, Cheung E, Solorzano C, van der Schaar M, SooHoo NF",2021,J Shoulder Elb Arthroplast,5,,24715492211038172,"BACKGROUND: Reverse total shoulder arthroplasty (rTSA) offers tremendous promise for the treatment of complex pathologies beyond the scope of anatomic total shoulder arthroplasty but is associated with a higher rate of major postoperative complications. We aimed to design and validate a machine learning (ML) model to predict major postoperative complications or readmission following rTSA.
METHODS: We retrospectively reviewed California's Office of Statewide Health Planning and Development database for patients who underwent rTSA between 2015 and 2017. We implemented logistic regression (LR), extreme gradient boosting (XGBoost), gradient boosting machines, adaptive boosting, and random forest classifiers in Python and trained these models using 64 binary, continuous, and discrete variables to predict the occurrence of at least one major postoperative complication or readmission following primary rTSA. Models were validated using the standard metrics of area under the receiver operating characteristic (AUROC) curve, area under the precision-recall curve (AUPRC), and Brier scores. The key factors for the top-performing model were determined.
RESULTS: Of 2799 rTSAs performed during the study period, 152 patients (5%) had at least 1 major postoperative complication or 30-day readmission. XGBoost had the highest AUROC and AUPRC of 0.681 and 0.129, respectively. The key predictive features in this model were patients with a history of implant complications, protein-calorie malnutrition, and a higher number of comorbidities.
CONCLUSION: Our study reports an ML model for the prediction of major complications or 30-day readmission following rTSA. XGBoost outperformed traditional LR models and also identified key predictive features of complications and readmission."
32089684,PMC7013307,10.1155/2020/6525787,All-Trans Retinoic Acid Inhibits Bone Marrow Mesenchymal Stem Cell Commitment to Adipocytes via Upregulating FRA1 Signaling.,"Xie L, Zou L, Chen J, Liu Y",2020,Int J Endocrinol,2020,,6525787,"Obesity, caused by an increased number and volume of adipocytes, is a global epidemic that seriously threatens human health. Bone marrow mesenchymal stem cells (BMSCs) can differentiate into adipocytes. All-trans retinoic acid (atRA, the active form of vitamin A) inhibits the adipogenic differentiation of BMSCs through its receptor RARG. The expression level of FRA1 (FOS like 1, AP-1 transcription factor subunit) in atRA-treated BMSCs increased, suggesting that atRA-mediated inhibition of BMSCs adipogenesis involves FRA1. BMSCs were transfected with adenovirus overexpressing Fra1 (ad-fra1) or silenced for Fra1 (si-fra1) and then treated with atRA. BMSCs treated with atRA and treated with ad-fra1 showed decreased mRNA and protein levels of key adipogenic genes (Pparg2, Cebpa) and adipogenesis-associated genes (Cd36, Fabp, Lpl, and Plin); atRA had a stronger inhibitory effect on adipogenesis compared with that in the ad-fra1 group. Adipogenic gene expression in Fra1-silenced BMSCs was significantly upregulated. Compared with that in the atRA group, the si-fra1 + atRA also upregulated adipogenic gene expression. However, compared with si-fra1, si-fra1 + atRA significantly inhibited adipogenic differentiation. Chromatin immunoprecipitation showed that RARG directly regulates Fra1 and FRA1 directly regulates Pparg2 and Cebpa. The results supported the conclusion that atRA inhibits BMSC adipogenesis partially through the RARG-FRA1-PPARG2 or the CEBPA axis or both. Thus, vitamin A might be used to treat obesity and its related diseases."
18927618,PMC2562983,10.1371/journal.pone.0003447,PP2A-mediated dephosphorylation of p107 plays a critical role in chondrocyte cell cycle arrest by FGF.,"Kolupaeva V, Laplantine E, Basilico C",2008,PLoS One,3,10,e3447,"FGF signaling inhibits chondrocyte proliferation, a cell type-specific response that is the basis for several genetic skeletal disorders caused by activating FGFR mutations. This phenomenon requires the function of the p107 and p130 members of the Rb protein family, and p107 dephosphorylation is one of the earliest distinguishing events in FGF-induced growth arrest. To determine whether p107 dephoshorylation played a critical role in the chondrocyte response to FGF, we sought to counteract this process by overexpressing in RCS chondrocytes the cyclin D1/cdk4 kinase complex. CyclinD/cdk4-expressing RCS cells became resistant to FGF-induced p107 dephosphorylation and growth arrest, and maintained significantly high levels of cyclin E/cdk2 activity and of phosphorylated p130 at later times of FGF treatment. We explored the involvement of a phosphatase in p107 dephosphorylation. Expression of the SV40 small T-Ag, which inhibits the activity of the PP2A phosphatase, or knockdown of the expression of the PP2A catalytic subunit by RNA interference prevented p107 dephosphorylation and FGF-induced growth arrest of RCS cells. Furthermore, an association between p107 and PP2A was induced by FGF treatment. Our data show that p107 dephosphorylation is a key event in FGF-induced cell cycle arrest and indicate that in chondrocytes FGF activates the PP2A phosphatase to promote p107 dephosphorylation."
22253573,PMC3254663,10.1371/journal.pbio.1001238,USP8 promotes smoothened signaling by preventing its ubiquitination and changing its subcellular localization.,"Xia R, Jia H, Fan J, Liu Y, Jia J",2012,PLoS Biol,10,1,e1001238,"The seven transmembrane protein Smoothened (Smo) is a critical component of the Hedgehog (Hh) signaling pathway and is regulated by phosphorylation, dimerization, and cell-surface accumulation upon Hh stimulation. However, it is not clear how Hh regulates Smo accumulation on the cell surface or how Hh regulates the intracellular trafficking of Smo. In addition, little is known about whether ubiquitination is involved in Smo regulation. In this study, we demonstrate that Smo is multi-monoubiquitinated and that Smo ubiquitination is inhibited by Hh and by phosphorylation. Using an in vivo RNAi screen, we identified ubiquitin-specific protease 8 (USP8) as a deubiquitinase that down-regulates Smo ubiquitination. Inactivation of USP8 increases Smo ubiquitination and attenuates Hh-induced Smo accumulation, leading to decreased Hh signaling activity. Moreover, overexpression of USP8 prevents Smo ubiquitination and elevates Smo accumulation, leading to increased Hh signaling activity. Mechanistically, we show that Hh promotes the interaction of USP8 with Smo aa625-753, which covers the three PKA and CK1 phosphorylation clusters. Finally, USP8 promotes the accumulation of Smo at the cell surface and prevents localization to the early endosomes, presumably by deubiquitinating Smo. Our studies identify USP8 as a positive regulator in Hh signaling by down-regulating Smo ubiquitination and thereby mediating Smo intracellular trafficking."
23873214,PMC3752380,10.1038/nchembio.1298,A switch III motif relays signaling between a B12 enzyme and its G-protein chaperone.,"Lofgren M, Padovani D, Koutmos M, Banerjee R",2013,Nat Chem Biol,9,9,535-9,"Fidelity during cofactor assembly is essential for the proper functioning of metalloenzymes and is ensured by specific chaperones. MeaB, a G-protein chaperone for the coenzyme B12-dependent radical enzyme methylmalonyl-CoA mutase (MCM), uses the energy of GTP binding, hydrolysis or both to regulate cofactor loading into MCM, protect MCM from inactivation and rescue MCM that is inactivated during turnover. Typically, G proteins signal to client proteins using the conformationally mobile switch I and II loops. Crystallographic snapshots of MeaB reported herein reveal a new switch III element that has substantial conformational plasticity. Using alanine-scanning mutagenesis, we demonstrate that the switch III motif is critical for bidirectional signal transmission of the GTPase-activating protein activity of MCM and the chaperone functions of MeaB in the MeaB-MCM complex. Mutations in the switch III loop identified in patients corrupt this interprotein communication and lead to methylmalonic aciduria, an inborn error of metabolism."
24009510,PMC3757040,10.1371/journal.ppat.1003589,Signal peptidase complex subunit 1 participates in the assembly of hepatitis C virus through an interaction with E2 and NS2.,"Suzuki R, Matsuda M, Watashi K, Aizaki H, Matsuura Y, Wakita T, Suzuki T",2013,PLoS Pathog,9,8,e1003589,"Hepatitis C virus (HCV) nonstructural protein 2 (NS2) is a hydrophobic, transmembrane protein that is required not only for NS2-NS3 cleavage, but also for infectious virus production. To identify cellular factors that interact with NS2 and are important for HCV propagation, we screened a human liver cDNA library by split-ubiquitin membrane yeast two-hybrid assay using full-length NS2 as a bait, and identified signal peptidase complex subunit 1 (SPCS1), which is a component of the microsomal signal peptidase complex. Silencing of endogenous SPCS1 resulted in markedly reduced production of infectious HCV, whereas neither processing of structural proteins, cell entry, RNA replication, nor release of virus from the cells was impaired. Propagation of Japanese encephalitis virus was not affected by knockdown of SPCS1, suggesting that SPCS1 does not widely modulate the viral lifecycles of the Flaviviridae family. SPCS1 was found to interact with both NS2 and E2. A complex of NS2, E2, and SPCS1 was formed in cells as demonstrated by co-immunoprecipitation assays. Knockdown of SPCS1 impaired interaction of NS2 with E2. Our findings suggest that SPCS1 plays a key role in the formation of the membrane-associated NS2-E2 complex via its interaction with NS2 and E2, which leads to a coordinating interaction between the structural and non-structural proteins and facilitates the early step of assembly of infectious particles."
25093327,PMC4122339,10.1371/journal.pbio.1001921,Carbonic anhydrase generates CO2 and H+ that drive spider silk formation via opposite effects on the terminal domains.,"Andersson M, Chen G, Otikovs M, Landreh M, Nordling K, Kronqvist N, Westermark P, Jörnvall H, Knight S, Ridderstråle Y, Holm L, Meng Q, Jaudzems K, Chesler M, Johansson J, Rising A",2014,PLoS Biol,12,8,e1001921,"Spider silk fibers are produced from soluble proteins (spidroins) under ambient conditions in a complex but poorly understood process. Spidroins are highly repetitive in sequence but capped by nonrepetitive N- and C-terminal domains (NT and CT) that are suggested to regulate fiber conversion in similar manners. By using ion selective microelectrodes we found that the pH gradient in the silk gland is much broader than previously known. Surprisingly, the terminal domains respond in opposite ways when pH is decreased from 7 to 5: Urea denaturation and temperature stability assays show that NT dimers get significantly stabilized and then lock the spidroins into multimers, whereas CT on the other hand is destabilized and unfolds into ThT-positive β-sheet amyloid fibrils, which can trigger fiber formation. There is a high carbon dioxide pressure (pCO2) in distal parts of the gland, and a CO2 analogue interacts with buried regions in CT as determined by nuclear magnetic resonance (NMR) spectroscopy. Activity staining of histological sections and inhibition experiments reveal that the pH gradient is created by carbonic anhydrase. Carbonic anhydrase activity emerges in the same region of the gland as the opposite effects on NT and CT stability occur. These synchronous events suggest a novel CO2 and proton-dependent lock and trigger mechanism of spider silk formation."
29568061,PMC5864832,10.1038/s41467-018-03523-2,An AP-MS- and BioID-compatible MAC-tag enables comprehensive mapping of protein interactions and subcellular localizations.,"Liu X, Salokas K, Tamene F, Jiu Y, Weldatsadik RG, Öhman T, Varjosalo M",2018,Nat Commun,9,1,1188,"Protein-protein interactions govern almost all cellular functions. These complex networks of stable and transient associations can be mapped by affinity purification mass spectrometry (AP-MS) and complementary proximity-based labeling methods such as BioID. To exploit the advantages of both strategies, we here design and optimize an integrated approach combining AP-MS and BioID in a single construct, which we term MAC-tag. We systematically apply the MAC-tag approach to 18 subcellular and 3 sub-organelle localization markers, generating a molecular context database, which can be used to define a protein's molecular location. In addition, we show that combining the AP-MS and BioID results makes it possible to obtain interaction distances within a protein complex. Taken together, our integrated strategy enables the comprehensive mapping of the physical and functional interactions of proteins, defining their molecular context and improving our understanding of the cellular interactome."
29562233,PMC5886804,10.1038/nature26139,Structural insights into the voltage and phospholipid activation of the mammalian TPC1 channel.,"She J, Guo J, Chen Q, Zeng W, Jiang Y, Bai XC",2018,Nature,556,7699,130-134,"The organellar two-pore channel (TPC) functions as a homodimer, in which each subunit contains two homologous Shaker-like six-transmembrane (6-TM)-domain repeats. TPCs belong to the voltage-gated ion channel superfamily and are ubiquitously expressed in animals and plants. Mammalian TPC1 and TPC2 are localized at the endolysosomal membrane, and have critical roles in regulating the physiological functions of these acidic organelles. Here we present electron cryo-microscopy structures of mouse TPC1 (MmTPC1)-a voltage-dependent, phosphatidylinositol 3,5-bisphosphate (PtdIns(3,5)P<sub>2</sub>)-activated Na+-selective channel-in both the apo closed state and ligand-bound open state. Combined with functional analysis, these structures provide comprehensive structural insights into the selectivity and gating mechanisms of mammalian TPC channels. The channel has a coin-slot-shaped ion pathway in the filter that defines the selectivity of mammalian TPCs. Only the voltage-sensing domain from the second 6-TM domain confers voltage dependence on MmTPC1. Endolysosome-specific PtdIns(3,5)P<sub>2</sub> binds to the first 6-TM domain and activates the channel under conditions of depolarizing membrane potential. Structural comparisons between the apo and PtdIns(3,5)P<sub>2</sub>-bound structures show the interplay between voltage and ligand in channel activation. These MmTPC1 structures reveal lipid binding and regulation in a 6-TM voltage-gated channel, which is of interest in light of the emerging recognition of the importance of phosphoinositide regulation of ion channels."
27875551,PMC5119734,10.1371/journal.pone.0165917,"Crystal Structures of Group B Streptococcus Glyceraldehyde-3-Phosphate Dehydrogenase: Apo-Form, Binary and Ternary Complexes.","Schormann N, Ayres CA, Fry A, Green TJ, Banerjee S, Ulett GC, Chattopadhyay D",2016,PLoS One,11,11,e0165917,"Glyceraldehyde 3-phosphate dehydrogenase or GAPDH is an evolutionarily conserved glycolytic enzyme. It catalyzes the two step oxidative phosphorylation of D-glyceraldehyde 3-phosphate into 1,3-bisphosphoglycerate using inorganic phosphate and NAD+ as cofactor. GAPDH of Group B Streptococcus is a major virulence factor and a potential vaccine candidate. Moreover, since GAPDH activity is essential for bacterial growth it may serve as a possible drug target. Crystal structures of Group B Streptococcus GAPDH in the apo-form, two different binary complexes and the ternary complex are described here. The two binary complexes contained NAD+ bound to 2 (mixed-holo) or 4 (holo) subunits of the tetrameric protein. The structure of the mixed-holo complex reveals the effects of NAD+ binding on the conformation of the protein. In the ternary complex, the phosphate group of the substrate was bound to the new Pi site in all four subunits. Comparison with the structure of human GAPDH showed several differences near the adenosyl binding pocket in Group B Streptococcus GAPDH. The structures also reveal at least three surface-exposed areas that differ in amino acid sequence compared to the corresponding areas of human GAPDH."
